{
  "$schema": "https://json-schema.org/draft/2020-12/schema",
  "$id": "https://aidazi.framework/schemas/quickfix-request.schema.json",
  "title": "Quick-Fix request",
  "description": "A per-session, structured Quick-Fix authorization. NOTE: this file is an ATTESTATION + a machine-verifiable scope declaration; it is NOT a signed, tamper-proof credential and `human_activation:true` does not prove activation. The REAL activation action is a human explicitly running the Quick-Fix launcher (or explicitly instructing the current session to run it) — see process/quickfix-lane.md. A malformed/missing request fails closed: the lane is NOT entered. Normative source: process/quickfix-lane.md; if this schema and that spec disagree, the spec wins.",
  "type": "object",
  "additionalProperties": false,
  "required": [
    "request_id",
    "created_by",
    "human_activation",
    "harness",
    "task_summary",
    "allowed_globs",
    "eligibility_attestation",
    "targeted_verification"
  ],
  "properties": {
    "request_id": {
      "type": "string",
      "pattern": "^[a-z0-9][a-z0-9._-]{0,63}$",
      "description": "Git-ref-/filesystem-safe slug. Names the quickfix/<request_id> branch, the ephemeral worktree, and the bundle. No slashes."
    },
    "created_by": {
      "type": "string",
      "minLength": 1,
      "description": "Human who authored the request (attestation; not an identity proof)."
    },
    "human_activation": {
      "const": true,
      "description": "ATTESTATION ONLY — the human asserts they are authorizing this Quick Fix. It is not unforgeable and is NOT the activation mechanism (running the launcher is). Required `true` so a missing/false value fails closed."
    },
    "harness": {
      "type": "string",
      "minLength": 1,
      "description": "Target coding-agent harness id (e.g. claude_code). The launcher fails closed unless this harness is marked `supported` in the harness-support registry (adapter delivered + cold-start evidence recorded)."
    },
    "task_summary": {
      "type": "string",
      "minLength": 12,
      "description": "What the fix is, in one or two sentences. Ambiguous/empty summaries fail the minLength gate; vague natural language ('just tidy up') is not a Quick-Fix authorization."
    },
    "allowed_globs": {
      "type": "array",
      "minItems": 1,
      "uniqueItems": true,
      "description": "Human-approved scope. The guard enforces that EVERY touched path (rename source AND destination) matches at least one of these. Repo-relative POSIX globs only.",
      "items": {
        "type": "string",
        "minLength": 1,
        "pattern": "^(?!/)(?!~)(?!.*(?:^|/)\\.\\.(?:/|$))[A-Za-z0-9._/*?-]+$",
        "description": "Repo-relative POSIX glob, SAFE SUBSET only: letters, digits, '.', '_', '-', '/', and the wildcards '*'/'**'/'?'. Character classes ('[...]'), brace expansion ('{...}'), commas, and negation ('!') are DISALLOWED because they can smuggle traversal/absolute semantics (e.g. '[.][.]', '{../x}', '[/]etc'). Also forbidden: absolute paths (leading '/'), '~', and '..' path segments. Adopter overlays may only ADD globs, never remove/exclude/override."
      }
    },
    "eligibility_attestation": {
      "type": "object",
      "additionalProperties": false,
      "description": "Human attestations. These are NECESSARY preconditions the human asserts; they are NOT the enforcement gate (the deterministic guard + allowed_globs subset are). All must be true to launch.",
      "required": [
        "non_behavioral_or_restores_agreed_behavior",
        "no_new_product_semantics_or_design_choice",
        "no_protected_surface",
        "targeted_verification_available",
        "within_approved_scope"
      ],
      "properties": {
        "non_behavioral_or_restores_agreed_behavior": { "const": true },
        "no_new_product_semantics_or_design_choice": { "const": true },
        "no_protected_surface": { "const": true },
        "targeted_verification_available": { "const": true },
        "within_approved_scope": { "const": true }
      }
    },
    "targeted_verification": {
      "type": "object",
      "additionalProperties": false,
      "required": ["argv"],
      "description": "Structured verification command. Executed with shell=False and a bounded cwd (verify.py). argv[0] is checked against an executable allowlist; a non-allowlisted executable requires explicit extra human confirmation. Runs AFTER a preliminary guard and is followed by a FINAL guard.",
      "properties": {
        "argv": {
          "type": "array",
          "minItems": 1,
          "items": { "type": "string", "minLength": 1 },
          "description": "Argument vector. No shell string; no shell metacharacter interpretation."
        },
        "cwd": {
          "type": "string",
          "default": ".",
          "pattern": "^(?!/)(?!~)(?!.*(?:^|/)\\.\\.(?:/|$))[A-Za-z0-9._/-]*$",
          "description": "Worktree-relative working dir for the verification. Must resolve inside the ephemeral worktree (enforced by verify.py); absolute/'..'/'~' rejected."
        }
      }
    },
    "base_ref": {
      "type": "string",
      "minLength": 1,
      "description": "Optional ref to branch the ephemeral worktree from. Default: the repo HEAD captured at launch (the baseline the guard binds to)."
    },
    "notes": {
      "type": "string",
      "description": "Optional free-text context for the record/audit. Non-authoritative."
    }
  }
}
